<?xml version="1.0" encoding="UTF-8" ?>
<!-- Copyright (c) 2012, University of Konstanz, Distributed Systems Group 
	All rights reserved. Redistribution and use in source and binary forms, with 
	or without modification, are permitted provided that the following conditions 
	are met: * Redistributions of source code must retain the above copyright 
	notice, this list of conditions and the following disclaimer. * Redistributions 
	in binary form must reproduce the above copyright notice, this list of conditions 
	and the following disclaimer in the documentation and/or other materials 
	provided with the distribution. * Neither the name of the University of Konstanz 
	nor the names of its contributors may be used to endorse or promote products 
	derived from this software without specific prior written permission. THIS 
	SOFTWARE IS PROVIDED BY THE COPYRIGHT HOLDERS AND CONTRIBUTORS "AS IS" AND 
	ANY EXPRESS OR IMPLIED WARRANTIES, INCLUDING, BUT NOT LIMITED TO, THE IMPLIED 
	WARRANTIES OF MERCHANTABILITY AND FITNESS FOR A PARTICULAR PURPOSE ARE DISCLAIMED. 
	IN NO EVENT SHALL <COPYRIGHT HOLDER> BE LIABLE FOR ANY DIRECT, INDIRECT, 
	INCIDENTAL, SPECIAL, EXEMPLARY, OR CONSEQUENTIAL DAMAGES (INCLUDING, BUT 
	NOT LIMITED TO, PROCUREMENT OF SUBSTITUTE GOODS OR SERVICES; LOSS OF USE, 
	DATA, OR PROFITS; OR BUSINESS INTERRUPTION) HOWEVER CAUSED AND ON ANY THEORY 
	OF LIABILITY, WHETHER IN CONTRACT, STRICT LIABILITY, OR TORT (INCLUDING NEGLIGENCE 
	OR OTHERWISE) ARISING IN ANY WAY OUT OF THE USE OF THIS SOFTWARE, EVEN IF 
	ADVISED OF THE POSSIBILITY OF SUCH DAMAGE. -->

<configuration xmlns:xsi="http://www.w3.org/2001/XMLSchema-instance"
  xmlns="http://www.jscsi.org/2010-04"
  xsi:schemaLocation="http://www.jscsi.org/2010-04 jscsi-target.xsd">

  <GlobalConfig>
    <AllowSloppyNegotiation>true</AllowSloppyNegotiation>
    <Port>3261</Port>
  </GlobalConfig>
  <TargetList>
    <Target>
      <PYStorage>
        <VolumnId>2214665917242855891</VolumnId>
      </PYStorage>
      <TargetAlias>jSCSI Target</TargetAlias>
      <TargetName>iqn.2013-11.py-firm</TargetName>
    </Target>
  </TargetList>
</configuration>

